{
  "meta": {
    "brand": "ST. JUICE",
    "version": "4.0.0-hq-only",
    "currency": "USD",
    "language": "en-US",
    "priceStatus": "working_requires_owner_approval",
    "ingredientStatus": "draft_requires_recipe_and_supplier_review",
    "nutritionStatus": "unverified_all_values_null",
    "primaryItemCount": 40,
    "groupFormatCount": 0,
    "activeDropCount": 2,
    "source": "St_Juice_HQ_Menu_Catalog.pdf page 4-23",
    "imageStatus": "40 exact photos prepared in separate upload bundle; source concepts; CDN migration pending"
  },
  "recordDefaults": {
    "allergenStatus": "draft_requires_supplier_and_kitchen_review",
    "crossContactPossible": true,
    "nutrition": {
      "status": "unverified",
      "values": null
    },
    "media": {
      "status": "scheduled_for_stage_04",
      "imageIds": [],
      "videoId": null
    },
    "locationIds": [
      "vandeventer"
    ],
    "availabilityStatus": "working_launch_catalog"
  },
  "categories": [
    {
      "id": "fresh-juices",
      "name": "Fresh Juices",
      "slug": "fresh-juices",
      "order": 1,
      "description": "Fruit and produce juices, shaken or pressed fresh."
    },
    {
      "id": "signatures",
      "name": "Signature Fruit Drinks",
      "slug": "signatures",
      "order": 2,
      "description": "Bright, fruit-forward ST. JUICE signatures."
    },
    {
      "id": "smoothies-protein",
      "name": "Smoothies",
      "slug": "smoothies-protein",
      "order": 3,
      "description": "Cold and creamy fruit smoothies."
    },
    {
      "id": "refreshers",
      "name": "Refreshers",
      "slug": "refreshers",
      "order": 4,
      "description": "Sparkling and refreshing fruit drinks."
    },
    {
      "id": "bowls-fruit",
      "name": "Bowls & Fruit Cups",
      "slug": "bowls-fruit",
      "order": 5,
      "description": "Fruit bowls and layered cups."
    },
    {
      "id": "mini-pancakes",
      "name": "Mini Pancakes",
      "slug": "mini-pancakes",
      "order": 6,
      "description": "Ten-piece mini pancake desserts."
    },
    {
      "id": "crepes-waffles",
      "name": "Crepes & Waffles",
      "slug": "crepes-waffles",
      "order": 7,
      "description": "Fresh crepes and waffle desserts."
    },
    {
      "id": "chocolate-lab",
      "name": "Chocolate",
      "slug": "chocolate-lab",
      "order": 8,
      "description": "Pistachio and chocolate specialties."
    },
    {
      "id": "desserts-drops",
      "name": "Desserts",
      "slug": "desserts-drops",
      "order": 9,
      "description": "Brownies and fruit desserts."
    },
    {
      "id": "coffee-matcha",
      "name": "Coffee & Matcha",
      "slug": "coffee-matcha",
      "order": 10,
      "description": "Chilled espresso and matcha."
    },
    {
      "id": "savory",
      "name": "Savory",
      "slug": "savory",
      "order": 11,
      "description": "Paninis, focaccia and wraps."
    },
    {
      "id": "wellness-shots",
      "name": "Juice Shots",
      "slug": "wellness-shots",
      "order": 12,
      "description": "Two-ounce juice shots. No therapeutic claims."
    }
  ],
  "products": [
    {
      "id": "citrus-sunrise",
      "categoryId": "fresh-juices",
      "name": "Citrus Sunrise",
      "slug": "citrus-sunrise",
      "catalogRole": "primary",
      "productType": "drink",
      "description": "Fresh juice served chilled.",
      "sizes": [
        {
          "id": "16oz",
          "label": "16 oz",
          "price": 8.5
        }
      ],
      "moods": [
        "fresh",
        "fruity"
      ],
      "occasions": [
        "morning",
        "afternoon",
        "evening"
      ],
      "draftIngredients": [],
      "containsAllergens": [],
      "allergenMode": "fixed",
      "modifierGroupIds": [],
      "availability": {
        "dayparts": [
          "all_day"
        ],
        "channels": [
          "dine_in",
          "pickup",
          "delivery"
        ],
        "deliverySuitability": "pending_packaging_validation"
      },
      "prepTimeMinutes": {
        "status": "working",
        "min": 4,
        "max": 12
      },
      "pairingIds": [
        "garden-green"
      ],
      "alternativeIds": [
        "golden-turmeric-shot"
      ],
      "hqNumber": 1,
      "hqPdfPage": 4,
      "conceptImagePath": "media/optimized/webp/hq-catalog/hq-01-citrus-sunrise.webp",
      "photoStatus": "concept_from_pdf_not_deployed"
    },
    {
      "id": "garden-green",
      "categoryId": "fresh-juices",
      "name": "Garden Green",
      "slug": "garden-green",
      "catalogRole": "primary",
      "productType": "drink",
      "description": "Fresh juice served chilled.",
      "sizes": [
        {
          "id": "16oz",
          "label": "16 oz",
          "price": 8.75
        }
      ],
      "moods": [
        "fresh",
        "fruity"
      ],
      "occasions": [
        "morning",
        "afternoon",
        "evening"
      ],
      "draftIngredients": [],
      "containsAllergens": [],
      "allergenMode": "fixed",
      "modifierGroupIds": [],
      "availability": {
        "dayparts": [
          "all_day"
        ],
        "channels": [
          "dine_in",
          "pickup",
          "delivery"
        ],
        "deliverySuitability": "pending_packaging_validation"
      },
      "prepTimeMinutes": {
        "status": "working",
        "min": 4,
        "max": 12
      },
      "pairingIds": [
        "ruby-root"
      ],
      "alternativeIds": [
        "citrus-sunrise"
      ],
      "hqNumber": 2,
      "hqPdfPage": 4,
      "conceptImagePath": "media/optimized/webp/hq-catalog/hq-02-garden-green.webp",
      "photoStatus": "concept_from_pdf_not_deployed"
    },
    {
      "id": "ruby-root",
      "categoryId": "fresh-juices",
      "name": "Ruby Root",
      "slug": "ruby-root",
      "catalogRole": "primary",
      "productType": "drink",
      "description": "Fresh juice served chilled.",
      "sizes": [
        {
          "id": "16oz",
          "label": "16 oz",
          "price": 8.75
        }
      ],
      "moods": [
        "fresh",
        "fruity"
      ],
      "occasions": [
        "morning",
        "afternoon",
        "evening"
      ],
      "draftIngredients": [],
      "containsAllergens": [],
      "allergenMode": "fixed",
      "modifierGroupIds": [],
      "availability": {
        "dayparts": [
          "all_day"
        ],
        "channels": [
          "dine_in",
          "pickup",
          "delivery"
        ],
        "deliverySuitability": "pending_packaging_validation"
      },
      "prepTimeMinutes": {
        "status": "working",
        "min": 4,
        "max": 12
      },
      "pairingIds": [
        "pineapple-mint"
      ],
      "alternativeIds": [
        "garden-green"
      ],
      "hqNumber": 3,
      "hqPdfPage": 5,
      "conceptImagePath": "media/optimized/webp/hq-catalog/hq-03-ruby-root.webp",
      "photoStatus": "concept_from_pdf_not_deployed"
    },
    {
      "id": "pineapple-mint",
      "categoryId": "fresh-juices",
      "name": "Pineapple Mint",
      "slug": "pineapple-mint",
      "catalogRole": "primary",
      "productType": "drink",
      "description": "Fresh juice served chilled.",
      "sizes": [
        {
          "id": "16oz",
          "label": "16 oz",
          "price": 8.5
        }
      ],
      "moods": [
        "fresh",
        "fruity"
      ],
      "occasions": [
        "morning",
        "afternoon",
        "evening"
      ],
      "draftIngredients": [],
      "containsAllergens": [],
      "allergenMode": "fixed",
      "modifierGroupIds": [],
      "availability": {
        "dayparts": [
          "all_day"
        ],
        "channels": [
          "dine_in",
          "pickup",
          "delivery"
        ],
        "deliverySuitability": "pending_packaging_validation"
      },
      "prepTimeMinutes": {
        "status": "working",
        "min": 4,
        "max": 12
      },
      "pairingIds": [
        "watermelon-lime"
      ],
      "alternativeIds": [
        "ruby-root"
      ],
      "hqNumber": 4,
      "hqPdfPage": 5,
      "conceptImagePath": "media/optimized/webp/hq-catalog/hq-04-pineapple-mint.webp",
      "photoStatus": "concept_from_pdf_not_deployed"
    },
    {
      "id": "watermelon-lime",
      "categoryId": "fresh-juices",
      "name": "Watermelon Lime",
      "slug": "watermelon-lime",
      "catalogRole": "primary",
      "productType": "drink",
      "description": "Fresh juice served chilled.",
      "sizes": [
        {
          "id": "16oz",
          "label": "16 oz",
          "price": 8.25
        }
      ],
      "moods": [
        "fresh",
        "fruity"
      ],
      "occasions": [
        "morning",
        "afternoon",
        "evening"
      ],
      "draftIngredients": [],
      "containsAllergens": [],
      "allergenMode": "fixed",
      "modifierGroupIds": [],
      "availability": {
        "dayparts": [
          "all_day"
        ],
        "channels": [
          "dine_in",
          "pickup",
          "delivery"
        ],
        "deliverySuitability": "pending_packaging_validation"
      },
      "prepTimeMinutes": {
        "status": "working",
        "min": 4,
        "max": 12
      },
      "pairingIds": [
        "mango-passion"
      ],
      "alternativeIds": [
        "pineapple-mint"
      ],
      "hqNumber": 5,
      "hqPdfPage": 6,
      "conceptImagePath": "media/optimized/webp/hq-catalog/hq-05-watermelon-lime.webp",
      "photoStatus": "concept_from_pdf_not_deployed"
    },
    {
      "id": "mango-passion",
      "categoryId": "signatures",
      "name": "Mango Passion",
      "slug": "mango-passion",
      "catalogRole": "primary",
      "productType": "drink",
      "description": "A signature fruit blend, served chilled.",
      "sizes": [
        {
          "id": "16oz",
          "label": "16 oz",
          "price": 9.25
        }
      ],
      "moods": [
        "sweet"